|prescription-key-0||||F|||||DC||1/30/2011|1/30/2011||2011/01/30|15:34:52  |O|||||||||||00781107710|||||||||||||||||||||||||||||||||||||||||||||||||||||||||||||||||||||||||||||||||||||||||hv-key-0
|prescription-key-1||||F|||||DC||2/5/2011|1/5/2011||2011/02/05|16:58:43  |O|||||||||||00456201001|||||||||||||||||||||||||||||||||||||||||||||||||||||||||||||||||||||||||||||||||||||||||hv-key-1
|prescription-key-2||||F|||||MD||1/10/2011|1/10/2011||2011/01/10|15:02:00  |O|A||||||||||13668000710|||||||||||||||||||||||||||||||||||||||||||||||||||||||||||||||||||||||||||||||||||||||||hv-key-2
|prescription-key-3||||F|||||MD||3/28/2011|3/28/2011||2011/03/28|09:49:07  |O|A||||||||||49884040410|||||||||||||||||||||||||||||||||||||||||||||||||||||||||||||||||||||||||||||||||||||||||hv-key-3
|prescription-key-4||||F|||||DC||1/3/2011|1/3/2011||2011/01/03|12:10:00  |O|A||||||||||00087277631|||||||||||||||||||||||||||||||||||||||||||||||||||||||||||||||||||||||||||||||||||||||||hv-key-4
|prescription-key-5||||F|||||DC||1/24/2011|1/24/2011||2011/01/24|12:43:39  |R|A||||||||||59417010510|||PRESCRIPTIONNUMBER||||||||||||||||||||||||||||||||||||||||||||||||||||||||||||||||||||||||||||||||||||||hv-key-5
|prescription-key-6||||F|||||DC||3/18/2011|3/14/2011||2011/03/18|11:58:55  |O|R||||||||||59417010510|||||||||||||||||||||||||||||||||||||||||||||||||||||||||||||||||||||||||||||||||||||||||hv-key-6
|prescription-key-7||||F|||||DC||2/18/2011|2/18/2011||2011/02/18|15:28:05  |O||1|||||||||59417010510|||||||||||||||||||||||||||||||||||||||||||||||||||||||||||||||||||||||||||||||||||||||||hv-key-7
|prescription-key-8||||M|||||VA||3/30/2011|3/30/2011||2011/03/30|10:30:22  |O|||2||||||||00185007001|||||||||||||||||||||||||||||||||||||||||||||||||||||||||||||||||||||||||||||||||||||||||hv-key-8
|prescription-key-9||||M|||||DC||2/14/2011|2/14/2011||2011/02/14|12:32:22  |O|||||3||||||00781181810|||||||||||||||||||||||||||||||||||||||||||||||||||||||||||||||||||||||||||||||||||||||||hv-key-9
|prescription-key-10||||M|||||DC||2/14/2011|2/14/2011||2011/02/14|12:32:22  |O|||||3||||||00781181810|||new
line||||||||||||||||||||||||||||||||||||||||||||||||||||||||||||||||||||||||||||||||||||||hv-key-9
